[
  {
    "id": "rs-01",
    "source": "SYNTHETIC",
    "source_note": "合成简历：化名，无真实个人信息",
    "candidate_alias": "陈明明",
    "city": "北京",
    "education": [
      {
        "institution": "某大学",
        "degree": "本科",
        "field_of_study": "计算机科学与技术",
        "dates": "2020.09-2024.06"
      }
    ],
    "experiences": [
      {
        "title": "AI 产品实习",
        "organization": "某互联网公司",
        "type": "INTERNSHIP",
        "dates": "2023.06-2023.12",
        "bullets": [
          "负责智能客服机器人的需求拆解与迭代排期，跟进 3 个版本上线",
          "搭建并维护标注规范文档，协同 5 人团队完成 2000 条对话数据质检",
          "通过埋点分析定位回复质量下降原因，推动 prompt 优化后问题解决率提升"
        ]
      },
      {
        "title": "校园二手交易平台",
        "organization": "校园项目",
        "type": "PROJECT",
        "dates": "2022.09-2023.05",
        "bullets": [
          "担任产品负责人，完成从需求调研到上线的完整闭环，累计注册用户 800+",
          "设计信任分体系，纠纷率下降约 30%"
        ]
      }
    ],
    "skills": [
      "Python",
      "SQL",
      "Figma",
      "Axure",
      "prompt 设计"
    ],
    "raw_text": "陈明明\n城市：北京\n\n教育背景\n某大学 计算机科学与技术 本科 2020.09-2024.06\n\n实习经历\nAI 产品实习 某互联网公司 2023.06-2023.12\n- 负责智能客服机器人的需求拆解与迭代排期，跟进 3 个版本上线\n- 搭建并维护标注规范文档，协同 5 人团队完成 2000 条对话数据质检\n- 通过埋点分析定位回复质量下降原因，推动 prompt 优化后问题解决率提升\n\n项目经历\n校园二手交易平台 校园项目 2022.09-2023.05\n- 担任产品负责人，完成从需求调研到上线的完整闭环，累计注册用户 800+\n- 设计信任分体系，纠纷率下降约 30%\n\n技能\nPython / SQL / Figma / Axure / prompt 设计"
  },
  {
    "id": "rs-02",
    "source": "SYNTHETIC",
    "source_note": "合成简历：化名，无真实个人信息",
    "candidate_alias": "李思远",
    "city": "上海",
    "education": [
      {
        "institution": "某财经大学",
        "degree": "本科",
        "field_of_study": "统计学",
        "dates": "2019.09-2023.06"
      }
    ],
    "experiences": [
      {
        "title": "数据分析师",
        "organization": "某零售集团",
        "type": "JOB",
        "dates": "2023.07-2025.03",
        "bullets": [
          "搭建门店周报与库存周转看板，覆盖 120 家门店的日常经营指标",
          "设计 A/B 实验评估流程，完成 15 组营销活动的效果归因与复盘",
          "用 SQL 与 Python 清洗订单数据，将报表出数时间从 2 天压缩到 4 小时"
        ]
      },
      {
        "title": "用户流失预警模型",
        "organization": "内部项目",
        "type": "PROJECT",
        "dates": "2024.03-2024.09",
        "bullets": [
          "基于历史行为特征建立流失预警模型，召回率 0.72",
          "联动运营团队做分层触达，次月留存相对提升 6 个百分点"
        ]
      }
    ],
    "skills": [
      "SQL",
      "Python",
      "Excel",
      "Tableau",
      "统计分析"
    ],
    "raw_text": "李思远\n城市：上海\n\n教育背景\n某财经大学 统计学 本科 2019.09-2023.06\n\n工作经历\n数据分析师 某零售集团 2023.07-2025.03\n- 搭建门店周报与库存周转看板，覆盖 120 家门店的日常经营指标\n- 设计 A/B 实验评估流程，完成 15 组营销活动的效果归因与复盘\n- 用 SQL 与 Python 清洗订单数据，将报表出数时间从 2 天压缩到 4 小时\n\n项目经历\n用户流失预警模型 内部项目 2024.03-2024.09\n- 基于历史行为特征建立流失预警模型，召回率 0.72\n- 联动运营团队做分层触达，次月留存相对提升 6 个百分点\n\n技能\nSQL / Python / Excel / Tableau / 统计分析"
  },
  {
    "id": "rs-03",
    "source": "SYNTHETIC",
    "source_note": "合成简历：化名，无真实个人信息",
    "candidate_alias": "王小雨",
    "city": "成都",
    "education": [
      {
        "institution": "某师范大学",
        "degree": "本科",
        "field_of_study": "网络与新媒体",
        "dates": "2020.09-2024.06"
      }
    ],
    "experiences": [
      {
        "title": "内容运营实习",
        "organization": "某快消公司",
        "type": "INTERNSHIP",
        "dates": "2023.06-2023.12",
        "bullets": [
          "负责小红书内容排期与选题库维护，累计产出 60 篇笔记",
          "联动 3 个达人完成新品测评合作，曝光量 12 万",
          "整理投放复盘模板，团队复用 5 次"
        ]
      }
    ],
    "skills": [
      "内容策划",
      "数据分析",
      "小红书运营",
      "Excel"
    ],
    "raw_text": "王小雨\n城市：成都\n\n教育背景\n某师范大学 网络与新媒体 本科 2020.09-2024.06\n\n实习经历\n内容运营实习 某快消公司 2023.06-2023.12\n- 负责小红书内容排期与选题库维护，累计产出 60 篇笔记\n- 联动 3 个达人完成新品测评合作，曝光量 12 万\n- 整理投放复盘模板，团队复用 5 次\n\n技能\n内容策划 / 数据分析 / 小红书运营 / Excel"
  },
  {
    "id": "rs-04",
    "source": "SYNTHETIC",
    "source_note": "合成简历：化名，无真实个人信息",
    "candidate_alias": "赵子航",
    "city": "深圳",
    "education": [
      {
        "institution": "某理工大学",
        "degree": "本科",
        "field_of_study": "软件工程",
        "dates": "2020.09-2024.06"
      }
    ],
    "experiences": [
      {
        "title": "后端开发实习",
        "organization": "某科技公司",
        "type": "INTERNSHIP",
        "dates": "2023.07-2024.01",
        "bullets": [
          "参与订单服务重构，把下单接口平均响应时间从 480ms 降到 210ms",
          "搭建灰度发布与回滚流程，覆盖 6 个核心服务",
          "补齐单元测试与 CI 卡点，主分支回归缺陷数下降约 40%"
        ]
      },
      {
        "title": "分布式任务调度器",
        "organization": "个人项目",
        "type": "PROJECT",
        "dates": "2022.10-2023.04",
        "bullets": [
          "设计基于优先级队列的调度器，支撑每日 30 万次任务执行",
          "实现失败重试与幂等控制，重复执行率降到 0.1% 以下"
        ]
      }
    ],
    "skills": [
      "Java",
      "Go",
      "MySQL",
      "Redis",
      "Kafka",
      "Docker"
    ],
    "raw_text": "赵子航\n城市：深圳\n\n教育背景\n某理工大学 软件工程 本科 2020.09-2024.06\n\n实习经历\n后端开发实习 某科技公司 2023.07-2024.01\n- 参与订单服务重构，把下单接口平均响应时间从 480ms 降到 210ms\n- 搭建灰度发布与回滚流程，覆盖 6 个核心服务\n- 补齐单元测试与 CI 卡点，主分支回归缺陷数下降约 40%\n\n项目经历\n分布式任务调度器 个人项目 2022.10-2023.04\n- 设计基于优先级队列的调度器，支撑每日 30 万次任务执行\n- 实现失败重试与幂等控制，重复执行率降到 0.1% 以下\n\n技能\nJava / Go / MySQL / Redis / Kafka / Docker"
  },
  {
    "id": "rs-05",
    "source": "SYNTHETIC",
    "source_note": "合成简历：化名，无真实个人信息",
    "candidate_alias": "林小满",
    "city": "杭州",
    "education": [
      {
        "institution": "某美术学院",
        "degree": "本科",
        "field_of_study": "视觉传达",
        "dates": "2020.09-2024.06"
      }
    ],
    "experiences": [
      {
        "title": "UI 设计实习",
        "organization": "某电商公司",
        "type": "INTERNSHIP",
        "dates": "2023.07-2023.12",
        "bullets": [
          "参与中后台设计规范组件整理，输出 40+ 个组件",
          "独立完成 2 个运营活动页设计，上线后点击率提升 18%",
          "协助维护 Figma 组件库与切图交付流程"
        ]
      }
    ],
    "skills": [
      "Figma",
      "Sketch",
      "Illustrator",
      "After Effects"
    ],
    "raw_text": "林小满\n城市：杭州\n\n教育背景\n某美术学院 视觉传达 本科 2020.09-2024.06\n\n实习经历\nUI 设计实习 某电商公司 2023.07-2023.12\n- 参与中后台设计规范组件整理，输出 40+ 个组件\n- 独立完成 2 个运营活动页设计，上线后点击率提升 18%\n- 协助维护 Figma 组件库与切图交付流程\n\n技能\nFigma / Sketch / Illustrator / After Effects"
  },
  {
    "id": "rs-06",
    "source": "SYNTHETIC",
    "source_note": "合成简历：化名，无真实个人信息",
    "candidate_alias": "郑安然",
    "city": "北京",
    "education": [
      {
        "institution": "某大学",
        "degree": "本科",
        "field_of_study": "市场营销",
        "dates": "2019.09-2023.06"
      }
    ],
    "experiences": [
      {
        "title": "大客户销售",
        "organization": "某 SaaS 公司",
        "type": "JOB",
        "dates": "2023.07-2025.01",
        "bullets": [
          "负责教育行业 KA 客户开发与续约，年度回款完成率 108%",
          "主导 3 个百万级客单的投标与谈判，平均销售周期 4 个月",
          "搭建客户分层跟进机制，重点客户季度拜访覆盖率 100%"
        ]
      }
    ],
    "skills": [
      "客户开发",
      "方案讲解",
      "CRM 管理",
      "投标谈判"
    ],
    "raw_text": "郑安然\n城市：北京\n\n教育背景\n某大学 市场营销 本科 2019.09-2023.06\n\n工作经历\n大客户销售 某 SaaS 公司 2023.07-2025.01\n- 负责教育行业 KA 客户开发与续约，年度回款完成率 108%\n- 主导 3 个百万级客单的投标与谈判，平均销售周期 4 个月\n- 搭建客户分层跟进机制，重点客户季度拜访覆盖率 100%\n\n技能\n客户开发 / 方案讲解 / CRM 管理 / 投标谈判"
  },
  {
    "id": "rs-07",
    "source": "SYNTHETIC",
    "source_note": "合成简历：化名，无真实个人信息",
    "candidate_alias": "何欣然",
    "city": "深圳",
    "education": [
      {
        "institution": "某大学",
        "degree": "本科",
        "field_of_study": "人力资源管理",
        "dates": "2020.09-2024.06"
      }
    ],
    "experiences": [
      {
        "title": "招聘专员",
        "organization": "某制造集团",
        "type": "JOB",
        "dates": "2024.03-2025.02",
        "bullets": [
          "负责工程师岗位全流程招聘，年均入职 35 人",
          "重建技术岗面试评估表，面试通过率与入职一年留存同步提升",
          "管理 4 家招聘渠道供应商并季度复盘"
        ]
      }
    ],
    "skills": [
      "招聘全流程",
      "面试评估",
      "渠道管理",
      "Excel"
    ],
    "raw_text": "何欣然\n城市：深圳\n\n教育背景\n某大学 人力资源管理 本科 2020.09-2024.06\n\n工作经历\n招聘专员 某制造集团 2024.03-2025.02\n- 负责工程师岗位全流程招聘，年均入职 35 人\n- 重建技术岗面试评估表，面试通过率与入职一年留存同步提升\n- 管理 4 家招聘渠道供应商并季度复盘\n\n技能\n招聘全流程 / 面试评估 / 渠道管理 / Excel"
  },
  {
    "id": "rs-08",
    "source": "SYNTHETIC",
    "source_note": "合成简历：化名，无真实个人信息",
    "candidate_alias": "吴迪",
    "city": "上海",
    "education": [
      {
        "institution": "某外国语大学",
        "degree": "本科",
        "field_of_study": "英语",
        "dates": "2019.09-2023.06"
      }
    ],
    "experiences": [
      {
        "title": "客户成功专员",
        "organization": "某软件公司",
        "type": "JOB",
        "dates": "2023.08-2025.04",
        "bullets": [
          "负责 60 家存量客户的续费与增购，续费率 91%",
          "搭建客户健康分模型，提前 60 天识别流失风险客户",
          "组织 12 场线上客户培训，NPS 提升 9 分"
        ]
      }
    ],
    "skills": [
      "客户沟通",
      "续费管理",
      "数据分析",
      "培训讲解"
    ],
    "raw_text": "吴迪\n城市：上海\n\n教育背景\n某外国语大学 英语 本科 2019.09-2023.06\n\n工作经历\n客户成功专员 某软件公司 2023.08-2025.04\n- 负责 60 家存量客户的续费与增购，续费率 91%\n- 搭建客户健康分模型，提前 60 天识别流失风险客户\n- 组织 12 场线上客户培训，NPS 提升 9 分\n\n技能\n客户沟通 / 续费管理 / 数据分析 / 培训讲解"
  },
  {
    "id": "rs-09",
    "source": "SYNTHETIC",
    "source_note": "合成简历：化名，无真实个人信息",
    "candidate_alias": "许志强",
    "city": "远程",
    "education": [
      {
        "institution": "某理工大学",
        "degree": "硕士",
        "field_of_study": "计算机技术",
        "dates": "2018.09-2021.06"
      }
    ],
    "experiences": [
      {
        "title": "后端工程师",
        "organization": "某云服务公司",
        "type": "JOB",
        "dates": "2021.07-2025.05",
        "bullets": [
          "设计并落地服务网格流量治理方案，线上故障平均恢复时间缩短 60%",
          "开发配置中心与任务调度中间件，支撑 200+ 微服务",
          "主导技术方案评审流程，输出团队技术雷达"
        ]
      },
      {
        "title": "开源任务队列库",
        "organization": "开源社区",
        "type": "PROJECT",
        "dates": "2022.01-2024.12",
        "bullets": [
          "维护一款任务队列开源库，GitHub star 2.3k",
          "处理社区 issue 与 PR，累计合并 60+ 贡献者提交"
        ]
      }
    ],
    "skills": [
      "Go",
      "Kubernetes",
      "gRPC",
      "Prometheus",
      "MySQL"
    ],